<?xml version="1.0" encoding="ISO-8859-1"?>
<macroscopicnetwork
	 xmlns:xsi="http://www.w3.org/2001/XMLSchema-instance"
	 xmlns:gml="http://www.opengis.net/gml"											
	 xsi:noNamespaceSchemaLocation="../schema/macroscopicsupplyinput.xsd">						<!-- use xs:import to import the gml namespace into the xsd to specify the reused elements -->
	<configuration>																		<!-- optional, single linksegmenttype assumed when absent -->
		<linksegmenttypes>																<!-- optional, if not present a default link segment type is used for all links -->
			<linksegmenttype id="1">													<!-- mandatory attribute -->
				<name>local road</name>													<!-- optional -->
				<maxdensitylane>180</maxdensitylane>									<!-- optional, has default -->
				<capacitylane>2000</capacitylane>										<!-- optional, has default -->
				<mode ref="1">															<!-- optional, when 0 it refers to all modes, when a mode is absent the mode is assumed to be banned from the link segment -->
					<maxspeed>40</maxspeed>												<!-- mandatory, should be lower or equal than link max speed when present -->
					<critspeed>35</critspeed>											<!-- optional (no default), idfdefined should be lower or equal than (mode specific) link max speed when present, represents the speed at capacity -->
				</mode>
			</linksegmenttype>
		</linksegmenttypes>			
	</configuration>
	<infrastructure srsname="EPSG:4326">												<!-- srsName indicates the spatial reference system used for all gml elements, if not provided a cartesian (top-left: 0,0) system is assumed -->  
		<nodes>
			<node id="1"> 																<!-- mandatory attribute -->
				<name>George Street roundabout</name> 									<!-- optional -->
                <gml:Point> 															<!-- mandatory -->
                    <gml:pos>150.512796 -34.900145</gml:pos>
                </gml:Point>														
			</node>
			<node id="2"> 
				<name>Broadway intersection</name>
				<gml:Point> 															<!-- mandatory -->
                    <gml:pos>150.512527 -34.900319</gml:pos>
                </gml:Point> 					
			</node>				
		</nodes>		
		<links>
			<link id="1">																<!-- optional since it can be derived from the two nodes -->
				<name>Broadway</name>													<!-- optional -->
				<linksegment id="1" dir="a_b" nodearef="1" nodebref="2" typeref="1">	<!-- mandatory attributes, except for id can be derived from direction, and typeref which if absent must mean there are no linksegmenttypes defined and we use default one-->
					<noflanes>2</noflanes>												<!-- optional, has default -->
					<maxspeed>50</maxspeed>												<!-- optional, has (deduced?) default (Q:do we make this part of link segmenttype or not?)-->						
				</linksegment>
				<linksegment id="2" dir="b_a" nodearef="1" nodebref="2" typeref="1">
					<noflanes>1</noflanes>
					<maxspeed>50</maxspeed>
				</linksegment>					
				<gml:LineString>														<!-- optional, indicating shape points on the link, in case the first and last coordinate do not match the node points, the node points are added to the string -->
					<gml:coordinates cs=" " ts=",">100,200 150,300</gml:coordinates>
				</gml:LineString>	
				<length>1.33</length>													<!-- manual override of link length in case for some reason the coordinates should not be used to deduce the length -->				
			</link>
		</links>
	</infrastructure>
</macroscopicnetwork>